{
  "metadata": {
    "schema_version": "1.1.0",
    "run_id": "RUN-20260527-143200",
    "generated_at": "2026-05-27T14:32:00Z",
    "input_query_count": 1,
    "queries_processed": 1,
    "queries_skipped": {},
    "sources_enabled": ["serpapi_scholar"],
    "per_source_stats": {
      "serpapi_scholar": {"queries_run": 1, "results_raw": 4, "retries": 0, "errors": 0}
    },
    "credits_used": 1,
    "credits_max": 50,
    "candidates_total_raw": 4,
    "candidates_after_dedupe": 4,
    "null_result_queries": 0,
    "mock_mode": true,
    "serpapi_engine": "google_scholar"
  },
  "results": [
    {
      "candidate_id": "CAND-RUN-20260527-143200-000001",
      "discovery_run_id": "RUN-20260527-143200",
      "discovered_via": "serpapi_scholar",
      "merged_from_sources": ["serpapi_scholar"],
      "merged_from_queries": ["SC3-step3"],
      "discovered_query": "(\"PE signal\" OR \"active inference\") AND \"buildings\"",
      "discovered_query_display_id": "SC3-step3",
      "source_voi_score": 0.85,
      "discovered_at": "2026-05-27T14:32:01Z",
      "result_position": 1,
      "title_raw": "Sensorimotor brain dynamics reflect architectural affordances",
      "title_normalized": "sensorimotor brain dynamics reflect architectural affordances",
      "doi": "10.1073/pnas.1912264116",
      "url": "https://www.pnas.org/doi/10.1073/pnas.1912264116",
      "snippet": "Predictive mechanisms originating from the motor system allow inferring actions from environmental affordances.",
      "authors_raw": "Z Djebbara, LB Fich, L Petrini, K Gramann",
      "first_author_surname": "Djebbara",
      "publication_year": 2019,
      "venue": "Proceedings of the National Academy of Sciences",
      "cited_by_count": 176,
      "resource_pdf_url": "https://www.pnas.org/doi/pdf/10.1073/pnas.1912264116"
    },
    {
      "candidate_id": "CAND-RUN-20260527-143200-000002",
      "discovery_run_id": "RUN-20260527-143200",
      "discovered_via": "scholarly_search",
      "merged_from_sources": ["scholarly_search"],
      "merged_from_queries": ["SC3-step3"],
      "discovered_query": "(\"PE signal\" OR \"active inference\") AND \"buildings\"",
      "discovered_query_display_id": "SC3-step3",
      "source_voi_score": 0.85,
      "discovered_at": "2026-05-27T14:32:02Z",
      "result_position": 2,
      "title_raw": "The brain dynamics of architectural affordances during transition",
      "title_normalized": "the brain dynamics of architectural affordances during transition",
      "doi": null,
      "url": "https://www.nature.com/articles/s41598-021-89736-6",
      "snippet": "Alpha-band oscillations covary with architectural affordances.",
      "authors_raw": "Z Djebbara, LB Fich, K Gramann",
      "first_author_surname": "Djebbara",
      "publication_year": 2021,
      "venue": "Scientific Reports",
      "cited_by_count": 70,
      "resource_pdf_url": null
    },
    {
      "candidate_id": "CAND-RUN-20260527-143200-000003",
      "discovery_run_id": "RUN-20260527-143200",
      "discovered_via": "paperscraper_search",
      "merged_from_sources": ["paperscraper_search"],
      "merged_from_queries": ["SC3-step3"],
      "discovered_query": "(\"PE signal\" OR \"active inference\") AND \"buildings\"",
      "discovered_query_display_id": "SC3-step3",
      "source_voi_score": 0.85,
      "discovered_at": "2026-05-27T14:32:03Z",
      "result_position": 3,
      "title_raw": "Architecture shapes event boundaries: Theta dynamics of event segmentation during spatial transitions",
      "title_normalized": "architecture shapes event boundaries theta dynamics of event segmentation during spatial transitions",
      "doi": null,
      "url": "https://www.biorxiv.org/content/10.1101/2026.01.15.123456",
      "snippet": "Reports a robust theta-band power increase after passing through a doorway.",
      "authors_raw": "M Dumesnil, N Djebbara-Bozo, Z Djebbara",
      "first_author_surname": "Dumesnil",
      "publication_year": 2026,
      "venue": "bioRxiv",
      "cited_by_count": 0,
      "resource_pdf_url": "https://www.biorxiv.org/content/10.1101/2026.01.15.123456.full.pdf"
    },
    {
      "candidate_id": "CAND-RUN-20260527-143200-000004",
      "discovery_run_id": "RUN-20260527-143200",
      "discovered_via": "serpapi_scholar",
      "merged_from_sources": ["serpapi_scholar", "scholarly_search"],
      "merged_from_queries": ["SC3-step3"],
      "discovered_query": "(\"PE signal\" OR \"active inference\") AND \"buildings\"",
      "discovered_query_display_id": "SC3-step3",
      "source_voi_score": 0.85,
      "discovered_at": "2026-05-27T14:32:04Z",
      "result_position": 4,
      "title_raw": "Less is more: expectation sharpens representations in the primary visual cortex",
      "title_normalized": "less is more expectation sharpens representations in the primary visual cortex",
      "doi": "10.1016/j.neuron.2012.09.005",
      "url": "https://doi.org/10.1016/j.neuron.2012.09.005",
      "snippet": "Perceptual expectation reduces neural response amplitude in V1.",
      "authors_raw": "P Kok, JFM Jehee, FP De Lange",
      "first_author_surname": "Kok",
      "publication_year": 2012,
      "venue": "Neuron",
      "cited_by_count": 1046,
      "resource_pdf_url": null
    }
  ],
  "null_results": [],
  "skipped_queries": []
}
